{"build_content_hash":"sha256:9c0ebc65b74bb88ee5244aad014efe271450375bdf0b40c58d6fcf41f19d3c0d","canonical_build_key":"PGX-DATA-20260906-001/9c0ebc65b74bb88e","content_hash":"sha256:bbe4d90937a5b68feaa797113d746a70362704214d172f1c2344bc26efbbefe4","dataset_lifecycle_state":"BUILDING","dataset_public_id":"PGX-DATA-20260906-001","decision":{"advisory_codes":["ENTITY_WITHOUT_EXTERNAL_ID"],"blocking_codes":["SNAPSHOT_COMPLETENESS_UNKNOWN","SOURCE_POLICY_NOT_APPROVED"],"effect":"A passing gate is a precondition for a human quality decision, not the decision itself. Nothing here transitions a dataset.","informational_codes":[],"passed":false,"rationale":"2 blocking finding kind(s) refuse this quality check: SNAPSHOT_COMPLETENESS_UNKNOWN, SOURCE_POLICY_NOT_APPROVED. The gate fails closed: an unanswered question blocks exactly as a refused one does."},"dq_report_version":"pgx-data-quality/1","issues":[{"code":"SNAPSHOT_COMPLETENESS_UNKNOWN","count":1,"detail":"the raw snapshot does not assert completeness. A build over a partial retrieval reports partial counts, and partial counts read exactly like complete ones.","examples":[],"severity":"BLOCKING","subject":"PGX-DATA-20260906-001"},{"code":"SOURCE_POLICY_NOT_APPROVED","count":1,"detail":"the source policy status is 'PENDING_REVIEW', not APPROVED","examples":[],"severity":"BLOCKING","subject":"PGX-DATA-20260906-001"},{"code":"ENTITY_WITHOUT_EXTERNAL_ID","count":6,"detail":"these entities carry no external identifier, so they can only ever be matched by name","examples":["DRUG:amitriptyline","DRUG:clopidogrel","DRUG:codeine","DRUG:omeprazole","GENE:CYP2C19"],"severity":"ADVISORY","subject":"canonical entities"}],"lifecycle_note":"This report describes a build. It does not approve one. The dataset remains BUILDING until a named human records a quality decision, and this package provides no way to record one.","metrics":{"alias_proposal_total":0,"approved_alias_total":0,"decided_queue_item_count":0,"distinct_record_total":35,"duplicate_counts":{"CONFLICTING_IDENTITY":{"group_count":0,"member_count":0},"EXACT":{"group_count":0,"member_count":0},"SEMANTIC":{"group_count":0,"member_count":0}},"duplicate_observation_total":0,"entities_with_external_id":0,"entity_counts":{"DRUG":4,"GENE":2},"entity_total":6,"excluded_record_counts":{},"identity_allocation_size":6,"observation_total":35,"provenance_link_total":6,"records_without_source_id":{},"resolution_counts":{"AMBIGUOUS":0,"BROKEN_REFERENCE":0,"INVALID_INPUT":0,"RESOLVED":10,"UNRESOLVED":0},"resolution_queue_size":0,"rule_versions":{"allocation_format_version":"pgx-identity-allocation/1","artifact_role_map_version":"pgx-artifact-roles/2","canonical_build_layout_version":"pgx-canonical-build/1","dedup_key_version":"pgx-dedup/1","extraction_rule_version":"pgx-extraction/1","normalization_rule_version":"pgx-normalization/1","resolver_policy_version":"pgx-resolver/1"},"source_policy_content_hash":null},"reconciliations":[{"accepted":4,"balances":true,"basis":"accepted = artifacts read as evidence; rejected = derived, out-of-scope or reference-only artifacts deliberately not read; deferred = artifacts the role map does not classify","deferred":0,"input_count":4,"rejected":0,"shortfall":0,"stream":"raw_artifacts"},{"accepted":6,"balances":true,"basis":"accepted = candidates that normalised and contributed to a canonical entity; rejected = candidates whose value could not be normalised at all","deferred":0,"input_count":6,"rejected":0,"shortfall":0,"stream":"entity_candidates"},{"accepted":10,"balances":true,"basis":"accepted = references that resolved to exactly one entity; rejected = values that could not be normalised; deferred = ambiguous, unresolved or broken references now in the resolution queue","deferred":0,"input_count":10,"rejected":0,"shortfall":0,"stream":"entity_references"},{"accepted":35,"balances":true,"basis":"accepted = distinct source records; deferred = additional observations of a record already counted, every one of which is retained inside its duplicate group; rejected is zero because no observation is discarded","deferred":0,"input_count":35,"rejected":0,"shortfall":0,"stream":"source_record_observations"}],"snapshot_manifest_hash":"sha256:4075ce582f11489b036570d0896f77c9f712f100651d7ae5fa620df3518210d4","source_observed_axes":{"basis":"counts of what this snapshot mentions. Not validated coverage, not clinical coverage, not supported treatment, not safe alternatives, not executable rules.","source_observed_container_families":{},"source_observed_drug_count":4,"source_observed_gene_count":2,"source_observed_pair_query_count":5,"source_observed_record_count":35}}
