{"build_content_hash":"sha256:61e892abb95facac239f28bdd9b61b9e6f7573ea4fd6861226ba30f0b22566c9","canonical_build_key":"PGX-DATA-20260830-900/61e892abb95facac","content_hash":"sha256:d04ae48561ae71a9fa1472bceddadd4c84370a0d211fd0a46ad562570f177ac9","dataset_lifecycle_state":"BUILDING","dataset_public_id":"PGX-DATA-20260830-900","decision":{"advisory_codes":["CONTAINER_SYNONYM_UNREVIEWED","SEMANTIC_DUPLICATE_CONTAINER"],"blocking_codes":["SNAPSHOT_NOT_ACQUIRED","SNAPSHOT_QUARANTINED","SOURCE_POLICY_MISSING"],"effect":"A passing gate is a precondition for a human quality decision, not the decision itself. Nothing here transitions a dataset.","informational_codes":["OUT_OF_SCOPE_DATA_EXCLUDED"],"passed":false,"rationale":"3 blocking finding kind(s) refuse this quality check: SNAPSHOT_NOT_ACQUIRED, SNAPSHOT_QUARANTINED, SOURCE_POLICY_MISSING. The gate fails closed: an unanswered question blocks exactly as a refused one does."},"dq_report_version":"pgx-data-quality/1","issues":[{"code":"SNAPSHOT_NOT_ACQUIRED","count":1,"detail":"the snapshot is a LEGACY_IMPORT: no acquisition run records which endpoints were called, when, or whether the responses were complete. Completeness relative to the upstream source is unknown and is not inferred from the fact that every file present was copied.","examples":[],"severity":"BLOCKING","subject":"PGX-DATA-20260830-900"},{"code":"SNAPSHOT_QUARANTINED","count":1,"detail":"the raw snapshot is QUARANTINED. Building from it is allowed so the data can be examined; passing a quality check on it is not.","examples":[],"severity":"BLOCKING","subject":"PGX-DATA-20260830-900"},{"code":"SOURCE_POLICY_MISSING","count":1,"detail":"no source-policy approval is on record for this dataset. An unregistered source has no permissions rather than unlimited ones.","examples":[],"severity":"BLOCKING","subject":"PGX-DATA-20260830-900"},{"code":"CONTAINER_SYNONYM_UNREVIEWED","count":29,"detail":"one source record reached through containers with different names (druglabel, label). These are not case variants, so they are not folded; whether they denote the same container is a review question.","examples":["CYP2C19::amitriptyline/PA166359761","CYP2C19::citalopram/PA166104852","CYP2C19::citalopram/PA166127650","CYP2C19::citalopram/PA166184123","CYP2C19::clopidogrel/PA166104777"],"severity":"ADVISORY","subject":"container naming"},{"code":"OUT_OF_SCOPE_DATA_EXCLUDED","count":8182,"detail":"candidate-onboarding records were counted and excluded from the P0 canonical dataset. Importing them would add drugs no reviewer selected.","examples":["candidate_edge: 8182"],"severity":"INFORMATIONAL","subject":"P1 candidate data"},{"code":"SEMANTIC_DUPLICATE_CONTAINER","count":1644,"detail":"the same source record was returned under more than one container spelling. The payloads are identical; only the source's capitalisation differs. Counting both is LEGACY-BUG-004.","examples":["pair_container_record|CYP2C19::amitriptyline|guidelineannotation|PA166105006","pair_container_record|CYP2C19::amitriptyline|guidelineannotation|PA166184526","pair_container_record|CYP2C19::amitriptyline|variantannotation|1183617143","pair_container_record|CYP2C19::amitriptyline|variantannotation|1183617161","pair_container_record|CYP2C19::amitriptyline|variantannotation|1183617173"],"severity":"ADVISORY","subject":"duplicate detection"}],"lifecycle_note":"This report describes a build. It does not approve one. The dataset remains BUILDING until a named human records a quality decision, and this package provides no way to record one.","metrics":{"alias_proposal_total":0,"approved_alias_total":0,"decided_queue_item_count":0,"distinct_record_total":1822,"duplicate_counts":{"CONFLICTING_IDENTITY":{"group_count":0,"member_count":0},"EXACT":{"group_count":0,"member_count":0},"SEMANTIC":{"group_count":1644,"member_count":3288}},"duplicate_observation_total":1644,"entities_with_external_id":16,"entity_counts":{"DRUG":11,"GENE":5},"entity_total":16,"excluded_record_counts":{"candidate_edge":8182},"identity_allocation_size":16,"observation_total":3466,"provenance_link_total":16,"records_without_source_id":{},"resolution_counts":{"AMBIGUOUS":0,"BROKEN_REFERENCE":0,"INVALID_INPUT":0,"RESOLVED":29,"UNRESOLVED":0},"resolution_queue_size":0,"rule_versions":{"allocation_format_version":"pgx-identity-allocation/1","artifact_role_map_version":"pgx-artifact-roles/1","canonical_build_layout_version":"pgx-canonical-build/1","dedup_key_version":"pgx-dedup/1","extraction_rule_version":"pgx-extraction/1","normalization_rule_version":"pgx-normalization/1","resolver_policy_version":"pgx-resolver/1"},"source_policy_content_hash":null},"reconciliations":[{"accepted":4,"balances":true,"basis":"accepted = artifacts read as evidence; rejected = derived, out-of-scope or reference-only artifacts deliberately not read; deferred = artifacts the role map does not classify","deferred":0,"input_count":12,"rejected":8,"shortfall":0,"stream":"raw_artifacts"},{"accepted":16,"balances":true,"basis":"accepted = candidates that normalised and contributed to a canonical entity; rejected = candidates whose value could not be normalised at all","deferred":0,"input_count":16,"rejected":0,"shortfall":0,"stream":"entity_candidates"},{"accepted":29,"balances":true,"basis":"accepted = references that resolved to exactly one entity; rejected = values that could not be normalised; deferred = ambiguous, unresolved or broken references now in the resolution queue","deferred":0,"input_count":29,"rejected":0,"shortfall":0,"stream":"entity_references"},{"accepted":1822,"balances":true,"basis":"accepted = distinct source records; deferred = additional observations of a record already counted, every one of which is retained inside its duplicate group; rejected is zero because no observation is discarded","deferred":1644,"input_count":3466,"rejected":0,"shortfall":0,"stream":"source_record_observations"}],"snapshot_manifest_hash":"sha256:3b79e3bfdde2de49d5a1a217e56d217455bd0fe9503929293ca95dda485075b7","source_observed_axes":{"basis":"counts of what this snapshot mentions. Not validated coverage, not clinical coverage, not supported treatment, not safe alternatives, not executable rules.","source_observed_container_families":{"druglabel":["DrugLabel"],"guidelineannotation":["GuidelineAnnotation","guidelineAnnotation"],"label":["label"],"variantannotation":["VariantAnnotation","variantAnnotation"]},"source_observed_drug_count":11,"source_observed_gene_count":5,"source_observed_pair_query_count":13,"source_observed_record_count":3466}}
